{
  "document_type": "portfolio",
  "locale": "zh-CN",
  "meta": {
    "title": "Momo Design Studio 作品集",
    "subtitle": "用设计解决复杂问题，用数据验证设计价值",
    "eyebrow": "Momo Paper / portfolio / zh-CN"
  },
  "sections": {
    "overview": {
      "body": [
        "Momo Design Studio 是一家专注于 B2B SaaS 产品体验设计的工作室。过去 5 年服务了 30+ 家企业客户，涵盖金融科技、医疗健康、供应链管理等领域。",
        "我们的核心理念：设计不是装饰，而是解决问题的工具。每个项目都从用户研究和业务目标出发，用数据衡量设计成果。"
      ]
    },
    "cases": [
      {
        "title": "案例一：FinFlow 支付平台重构",
        "context": "FinFlow 是一款面向中小企业的支付结算平台，日活用户 12 万，但用户流失率高达 35%。",
        "action": "通过用户访谈、热力图分析、A/B 测试，重新设计了核心支付流程。将 7 步结账流程缩减至 3 步，增加了智能默认选项。",
        "result": "支付完成率从 62% 提升至 89%，客服咨询量减少 40%。",
        "metrics": [
          { "label": "支付完成率", "value": "+27%" },
          { "label": "用户流失率", "value": "-18%" },
          { "label": "NPS 提升", "value": "+15" }
        ]
      },
      {
        "title": "案例二：HealthTrack 数据可视化系统",
        "context": "HealthTrack 为医院提供患者数据管理系统，医护人员反馈数据查看效率低，关键指标不突出。",
        "action": "设计了可自定义的仪表盘系统，引入智能告警机制。根据角色自动适配视图：医生看诊断指标，护士看护理任务，管理员看运营数据。",
        "result": "医护人员的日均数据查看时间从 45 分钟降至 15 分钟，遗漏告警减少 80%。",
        "metrics": [
          { "label": "数据查看时间", "value": "-67%" },
          { "label": "告警遗漏率", "value": "-80%" },
          { "label": "用户满意度", "value": "4.6/5" }
        ]
      }
    ],
    "capabilities": {
      "body": [
        "我们提供从用户研究、交互设计到视觉落地的全流程服务，并建立设计系统确保产品的一致性。"
      ],
      "skills": [
        "用户研究与体验地图",
        "交互设计与原型验证",
        "设计系统构建",
        "数据驱动的设计决策",
        "跨职能团队协作"
      ]
    }
  }
}
